[.], ack 562656, win 512, length 0
00:12:29.636369 IP ubuntu-s-1vcpu-1gb-tor1-01.ssh > 172.98.155.190.61291: Flags [P.], seq 563636:563808, ack 361, win 320, length 172
00:12:29.636595 IP ubuntu-s-1vcpu-1gb-tor1-01.ssh > 172.98.155.190.61291: Flags [P.], seq 563808:564100, ack 361, win 320, length 292
00:12:29.636706 IP ubuntu-s-1vcpu-1gb-tor1-01.ssh > 172.98.155.190.61291: Flags [P.], seq 564100:564272, ack 361, win 320, length 172
00:12:29.636824 IP ubuntu-s-1vcpu-1gb-tor1-01.ssh > 172.98.155.190.61291: Flags [P.], seq 564272:564444, ack 361, win 320, length 172
00:12:29.649770 IP 172.98.155.190.61291 > ubuntu-s-1vcpu-1gb-tor1-01.ssh: Flags [.], ack 562828, win 512, length 0
00:12:29.649809 IP ubuntu-s-1vcpu-1gb-tor1-01.ssh > 172.98.155.190.61291: Flags [P.], seq 564444:564616, ack 361, win 320, length 172
00:12:29.650800 IP 172.98.155.190.61291 > ubuntu-s-1vcpu-1gb-tor1-01.ssh: Flags [.], ack 563636, win 516, length 0
00:12:29.650826 IP ubuntu-s-1vcpu-1gb-tor1-01.ssh > 172.98.155.190.61291: Flags [P.], seq 564616:564908, ack 361, win 320, length 292
00:12:29.650990 IP ubuntu-s-1vcpu-1gb-tor1-01.ssh > 172.98.155.190.61291: Flags [P.], seq 564908:565200, ack 361, win 320, length 292
00:12:29.651131 IP ubuntu-s-1vcpu-1gb-tor1-01.ssh > 172.98.155.190.61291: Flags [P.], seq 565200:565372, ack 361, win 320, length 172
00:12:29.651248 IP ubuntu-s-1vcpu-1gb-tor1-01.ssh > 172.98.155.190.61291: Flags [P.], seq 565372:565544, ack 361, win 320, length 172
00:12:29.656236 IP 172.98.155.190.61291 > ubuntu-s-1vcpu-1gb-tor1-01.ssh: Flags [P.], seq 361:397, ack 563636, win 516, length 36
^C
3516 packets captured
3516 packets received by filter
0 packets dropped by kernel
