16:99272, ack 37, win 320, length 156
23:52:14.225445 IP 159.203.19.176.22 > 172.98.155.190.61291: Flags [P.], seq 99272:99532, ack 37, win 320, length 260
23:52:14.277847 IP 172.98.155.190.61291 > 159.203.19.176.22: Flags [.], ack 98856, win 514, options [nop,nop,sack 1 {99116:99272}], length 0
23:52:14.277913 IP 159.203.19.176.22 > 172.98.155.190.61291: Flags [P.], seq 98856:99116, ack 37, win 320, length 260
23:52:14.277983 IP 172.98.155.190.61291 > 159.203.19.176.22: Flags [.], ack 98856, win 514, options [nop,nop,sack 1 {99116:99532}], length 0
23:52:14.277998 IP 159.203.19.176.22 > 172.98.155.190.61291: Flags [P.], seq 99532:99688, ack 37, win 320, length 156
23:52:14.323416 IP 172.98.155.190.61291 > 159.203.19.176.22: Flags [.], ack 99532, win 511, length 0
23:52:14.323506 IP 159.203.19.176.22 > 172.98.155.190.61291: Flags [P.], seq 99688:100244, ack 37, win 320, length 556
23:52:14.349620 IP 172.98.155.190.61291 > 159.203.19.176.22: Flags [P.], seq 37:73, ack 99688, win 511, length 36
23:52:14.349680 IP 159.203.19.176.22 > 172.98.155.190.61291: Flags [P.], seq 100244:100504, ack 73, win 320, length 260
^C
664 packets captured
664 packets received by filter
0 packets dropped by kernel
